{
  "$schema": "https://json-schema.org/draft/2020-12/schema",
  "$id": "https://agentfacts.org/schemas/commercial/v1/agentfacts-commercial-categories-v1.json",
  "title": "AgentFacts Universal Commercial Categories v1.0",
  "description": "Core section structure for AgentFacts Commercial Metadata Standard with commerce capabilities - Apache 2.0 Licensed",
  "type": "object",
  "required": ["core_identity", "baseline_model"],
  "properties": {
    "core_identity": {
      "type": "object",
      "description": "REQUIRED: Unique agent identification and lifecycle metadata"
    },
    "baseline_model": {
      "type": "object", 
      "description": "REQUIRED: Foundation AI model transparency for commercial deployment"
    },
    "classification": {
      "type": "object",
      "description": "Universal categorization system including commercial context - EXTENSIBLE"
    },
    "capabilities": {
      "type": "object",
      "description": "Extensible capability declarations with commerce and payment protocols - COMMERCE ENABLED"
    },
    "authentication_permissions": {
      "type": "object",
      "description": "Enterprise-critical authentication, dynamic permissions & financial governance - COMMERCE ENABLED"
    },
    "compliance_regulatory": {
      "type": "object",
      "description": "Multi-jurisdictional regulatory compliance including financial regulations - EXTENSIBLE"
    },
    "performance_reputation": {
      "type": "object",
      "description": "Measurable quality metrics including commerce reliability and transaction success - COMMERCE ENABLED"
    },
    "supply_chain": {
      "type": "object",
      "description": "SBOM integration for supply chain transparency with license compliance - EXTENSIBLE"
    },
    "verification": {
      "type": "object",
      "description": "Cryptographic trust, multi-authority verification & confidence scoring - EXTENSIBLE"
    },
    "programmability": {
      "type": "object",
      "description": "Future-proofing mechanisms and extensibility framework - FULLY EXTENSIBLE"
    }
  },
  "additionalProperties": true
}
